{
  "schema_version": "v0.1",
  "grounding_id": "handle_eraser_p3sam_auto_mask_20260525_tool_candidates",
  "observation_id": "handle_eraser_p3sam_auto_mask_20260525",
  "frames": {
    "tool": {
      "frame_type": "simtoolreal_asset_root",
      "description": "All *_tool fields are expressed in the stable SimToolReal asset/root frame."
    }
  },
  "marks": {},
  "points": {
    "tool_center": {
      "label": "tool_center",
      "candidate_type": "whole_tool_center",
      "xyz_tool": [
        -0.0029862599999999975,
        -0.0004899049999999988,
        -0.03457254
      ],
      "confidence": 1.0,
      "source": "p3sam_tool_prior",
      "provenance": {
        "observation_id": "handle_eraser_p3sam_auto_mask_20260525",
        "method": "tool_mesh_bbox_center",
        "source_artifact": "simtoolreal/assets/urdf/dextoolbench/eraser/handle_eraser/handle_eraser.obj"
      }
    },
    "part_000_center": {
      "label": "part_000_center",
      "candidate_type": "geometry_anchor",
      "part_ref": "tool.parts.part_000",
      "xyz_tool": [
        -0.004993865,
        -6.27500000000003e-05,
        -0.01989448
      ],
      "confidence": 0.6745901701424515,
      "source": "p3sam_tool_prior",
      "provenance": {
        "observation_id": "handle_eraser_p3sam_auto_mask_20260525",
        "method": "p3sam_geometry_anchor",
        "source_artifact": "artifacts/tool_prior/p3sam/handle_eraser/face_labels/p3sam_face_labels.npy",
        "part_label": 0,
        "connected_component_index": 0,
        "connected_component_count": 19,
        "original_face_count": 3901,
        "kept_face_count": 3901,
        "removed_disconnected_face_count": 0,
        "component_filter": "keep_dominant_spatial_cluster_per_p3sam_label"
      }
    },
    "part_000_x_negative_endpoint": {
      "label": "part_000_x_negative_endpoint_center",
      "candidate_type": "geometry_surface_center",
      "part_ref": "tool.parts.part_000",
      "xyz_tool": [
        -0.07442494360452094,
        0.00019765117817762708,
        -0.027209310625744346
      ],
      "normal_tool": [
        -0.8996959621019543,
        0.0019796524412558467,
        0.4365126077831549
      ],
      "confidence": 0.6745901701424515,
      "source": "p3sam_tool_prior",
      "provenance": {
        "observation_id": "handle_eraser_p3sam_auto_mask_20260525",
        "method": "p3sam_mesh_surface_center",
        "source_artifact": "artifacts/tool_prior/p3sam/handle_eraser/face_labels/p3sam_face_labels.npy",
        "part_label": 0,
        "patch_id": "x_negative_endpoint",
        "role": "endpoint_contact_patch",
        "support_faces": 596,
        "connected_component_index": 0,
        "connected_component_count": 19,
        "original_face_count": 3901,
        "kept_face_count": 3901,
        "removed_disconnected_face_count": 0
      }
    },
    "part_000_x_positive_endpoint": {
      "label": "part_000_x_positive_endpoint_center",
      "candidate_type": "geometry_surface_center",
      "part_ref": "tool.parts.part_000",
      "xyz_tool": [
        0.0671703990909105,
        0.001171979249331818,
        -0.02917446363813252
      ],
      "normal_tool": [
        0.8923231849441331,
        -0.0017899194634829769,
        0.45139354204449206
      ],
      "confidence": 0.6745901701424515,
      "source": "p3sam_tool_prior",
      "provenance": {
        "observation_id": "handle_eraser_p3sam_auto_mask_20260525",
        "method": "p3sam_mesh_surface_center",
        "source_artifact": "artifacts/tool_prior/p3sam/handle_eraser/face_labels/p3sam_face_labels.npy",
        "part_label": 0,
        "patch_id": "x_positive_endpoint",
        "role": "endpoint_contact_patch",
        "support_faces": 706,
        "connected_component_index": 0,
        "connected_component_count": 19,
        "original_face_count": 3901,
        "kept_face_count": 3901,
        "removed_disconnected_face_count": 0
      }
    },
    "part_000_y_negative_contact": {
      "label": "part_000_y_negative_contact_center",
      "candidate_type": "geometry_surface_center",
      "part_ref": "tool.parts.part_000",
      "xyz_tool": [
        -0.000905592833195562,
        -0.027891773633092195,
        -0.0394102951227862
      ],
      "normal_tool": [
        0.0064671264073724085,
        -0.9819089887439252,
        0.189243002776624
      ],
      "confidence": 0.6745901701424515,
      "source": "p3sam_tool_prior",
      "provenance": {
        "observation_id": "handle_eraser_p3sam_auto_mask_20260525",
        "method": "p3sam_mesh_surface_center",
        "source_artifact": "artifacts/tool_prior/p3sam/handle_eraser/face_labels/p3sam_face_labels.npy",
        "part_label": 0,
        "patch_id": "y_negative_contact",
        "role": "contact_patch",
        "support_faces": 425,
        "connected_component_index": 0,
        "connected_component_count": 19,
        "original_face_count": 3901,
        "kept_face_count": 3901,
        "removed_disconnected_face_count": 0
      }
    },
    "part_000_y_positive_contact": {
      "label": "part_000_y_positive_contact_center",
      "candidate_type": "geometry_surface_center",
      "part_ref": "tool.parts.part_000",
      "xyz_tool": [
        0.0014228978732753138,
        0.028497014471845775,
        -0.03956652963935844
      ],
      "normal_tool": [
        0.004289553181019737,
        0.9816406039817346,
        0.19069169973515548
      ],
      "confidence": 0.6745901701424515,
      "source": "p3sam_tool_prior",
      "provenance": {
        "observation_id": "handle_eraser_p3sam_auto_mask_20260525",
        "method": "p3sam_mesh_surface_center",
        "source_artifact": "artifacts/tool_prior/p3sam/handle_eraser/face_labels/p3sam_face_labels.npy",
        "part_label": 0,
        "patch_id": "y_positive_contact",
        "role": "contact_patch",
        "support_faces": 399,
        "connected_component_index": 0,
        "connected_component_count": 19,
        "original_face_count": 3901,
        "kept_face_count": 3901,
        "removed_disconnected_face_count": 0
      }
    },
    "part_000_z_negative_contact": {
      "label": "part_000_z_negative_contact_center",
      "candidate_type": "geometry_surface_center",
      "part_ref": "tool.parts.part_000",
      "xyz_tool": [
        -0.00255305798920107,
        0.00152888674579652,
        -0.044345503857191375
      ],
      "normal_tool": [
        0.012659119429717145,
        -0.006343531782628373,
        -0.9998997481246742
      ],
      "confidence": 0.6745901701424515,
      "source": "p3sam_tool_prior",
      "provenance": {
        "observation_id": "handle_eraser_p3sam_auto_mask_20260525",
        "method": "p3sam_mesh_surface_center",
        "source_artifact": "artifacts/tool_prior/p3sam/handle_eraser/face_labels/p3sam_face_labels.npy",
        "part_label": 0,
        "patch_id": "z_negative_contact",
        "role": "contact_patch",
        "support_faces": 1031,
        "connected_component_index": 0,
        "connected_component_count": 19,
        "original_face_count": 3901,
        "kept_face_count": 3901,
        "removed_disconnected_face_count": 0
      }
    },
    "part_000_z_positive_contact": {
      "label": "part_000_z_positive_contact_center",
      "candidate_type": "geometry_surface_center",
      "part_ref": "tool.parts.part_000",
      "xyz_tool": [
        -0.006781741079255676,
        0.0004631208934997164,
        0.002925339081742942
      ],
      "normal_tool": [
        -0.010020484809383822,
        -0.012134604987742,
        0.9998761629551812
      ],
      "confidence": 0.6745901701424515,
      "source": "p3sam_tool_prior",
      "provenance": {
        "observation_id": "handle_eraser_p3sam_auto_mask_20260525",
        "method": "p3sam_mesh_surface_center",
        "source_artifact": "artifacts/tool_prior/p3sam/handle_eraser/face_labels/p3sam_face_labels.npy",
        "part_label": 0,
        "patch_id": "z_positive_contact",
        "role": "contact_patch",
        "support_faces": 481,
        "connected_component_index": 0,
        "connected_component_count": 19,
        "original_face_count": 3901,
        "kept_face_count": 3901,
        "removed_disconnected_face_count": 0
      }
    },
    "part_001_center": {
      "label": "part_001_center",
      "candidate_type": "geometry_anchor",
      "part_ref": "tool.parts.part_001",
      "xyz_tool": [
        -0.0027883549999999993,
        -0.0014157700000000002,
        -0.05956074
      ],
      "confidence": 0.9,
      "source": "p3sam_tool_prior",
      "provenance": {
        "observation_id": "handle_eraser_p3sam_auto_mask_20260525",
        "method": "p3sam_geometry_anchor",
        "source_artifact": "artifacts/tool_prior/p3sam/handle_eraser/face_labels/p3sam_face_labels.npy",
        "part_label": 131,
        "connected_component_index": 0,
        "connected_component_count": 573,
        "original_face_count": 15661,
        "kept_face_count": 15661,
        "removed_disconnected_face_count": 0,
        "component_filter": "keep_dominant_spatial_cluster_per_p3sam_label"
      }
    },
    "part_001_x_negative_endpoint": {
      "label": "part_001_x_negative_endpoint_center",
      "candidate_type": "geometry_surface_center",
      "part_ref": "tool.parts.part_001",
      "xyz_tool": [
        -0.07497247998623265,
        -0.0022226716325701406,
        -0.06186686445624655
      ],
      "normal_tool": [
        -0.9969413410050315,
        -0.04606686784537728,
        0.06313324228966902
      ],
      "confidence": 0.9,
      "source": "p3sam_tool_prior",
      "provenance": {
        "observation_id": "handle_eraser_p3sam_auto_mask_20260525",
        "method": "p3sam_mesh_surface_center",
        "source_artifact": "artifacts/tool_prior/p3sam/handle_eraser/face_labels/p3sam_face_labels.npy",
        "part_label": 131,
        "patch_id": "x_negative_endpoint",
        "role": "endpoint_contact_patch",